rag_id,id,date,reviewerTitle,ratingValue,ratingText,reviewReply,reviewReplyType,sentimentAnalysis,satisfactoryLevel,locationId,google_review_id,thirdPartyReviewSourcesId,url,full_review_json
REV_2139345_G_AbFvOqlw,2139345,2025-03-30 06:09:29.095000+00:00,Jesse,1,Drove all the way from West to stand in front of a closed shop that seems to be renovated or permanently closed. We double checked maps and it said open. It takes seconds to change opening hours on Google my business,"Dear Jesse,
Thank you for your feedback and for bringing this issue to our attention. 
We updated the relevant information across all channels immediately, weeks ago, and have double-checked on multiple devices to ensure that only the correct information is displayed. Unfortunately, sometimes it is necessary to clear the cache on personal devices to access the most current information. Despite these precautions, I am very sorry to hear about the inconvenience you experienced due to the changes. We truly appreciate your understanding and hope to have the opportunity to welcome you back in the future. If you ever visit Berlin, we would be delighted to host you at our location there.",dailyJobTemplate,Negative,60,93,AbFvOqlwkhi69bjpxMOJmS8VS5xDP7KwS2GFnM-crFduRcMhvTBBefYsQmwmYqCPdEjnCbkvAAjZpg,69,,"{""date"": ""2025-03-30 06:09:29.095000+00:00"", ""google_review_id"": ""AbFvOqlwkhi69bjpxMOJmS8VS5xDP7KwS2GFnM-crFduRcMhvTBBefYsQmwmYqCPdEjnCbkvAAjZpg"", ""id"": 2139345, ""isDraft"": false, ""ratingText"": ""Drove all the way from West to stand in front of a closed shop that seems to be renovated or permanently closed. We double checked maps and it said open. It takes seconds to change opening hours on Google my business"", ""ratingValue"": 1.0, ""replyByOpenAi"": false, ""reviewReply"": ""Dear Jesse,\nThank you for your feedback and for bringing this issue to our attention. \nWe updated the relevant information across all channels immediately, weeks ago, and have double-checked on multiple devices to ensure that only the correct information is displayed. Unfortunately, sometimes it is necessary to clear the cache on personal devices to access the most current information. Despite these precautions, I am very sorry to hear about the inconvenience you experienced due to the changes. We truly appreciate your understanding and hope to have the opportunity to welcome you back in the future. If you ever visit Berlin, we would be delighted to host you at our location there."", ""reviewReplyType"": ""dailyJobTemplate"", ""reviewerTitle"": ""Jesse"", ""url"": """", ""thirdPartyReviewSourcesId"": 69, ""locationId"": 93, ""processedByPastReplyJob"": false, ""replyFetchedByReviewAgent"": false, ""deleteReplyFailedByReviewAgent"": false, ""editReplyFailedByReviewAgent"": false, ""sentimentAnalysis"": ""Negative"", ""satisfactoryLevel"": 60.0, ""reviewStatus"": NaN, ""reviewTags"": [], ""task_id"": 28002.0, ""location_id"": 93, ""location_enableReviewAgent"": true, ""task"": NaN, ""reviewStatus_deleteReplyFailed"": NaN, ""reviewStatus_editReplyFailed"": NaN, ""reviewStatus_requestStatus"": NaN, ""reviewStatus_saveReplyFailed"": NaN, ""reviewStatus_sessionError"": NaN}"
REV_2139346_G_AbFvOqnt,2139346,2025-03-16 19:58:52.162000+00:00,rakel zetterlund,4,"Delicious food, a bit on the pricy side for brunch. Especially if you want to add something on (eg. Mushrooms) becaus the added portion is quite small. But overall the food and coffee was good!","Hi Rakel!

We're thrilled you enjoyed the food and coffee at FACTORY GIRL, and we appreciate your honest feedback about the pricing and portion sizes for add-ons. We'll take your comments on board as we're always looking to improve our brunch experience while maintaining the quality you've come to expect from us in Amsterdam.",dailyJobEmotionAI,Neutral,70,93,AbFvOqntc-sFDlJ18K1Fi9xBOLWUltbPCLk0YlIc__l4mYc4TwbW6KNS3cQxZybCLHbx5sX2A-1U,69,,"{""date"": ""2025-03-16 19:58:52.162000+00:00"", ""google_review_id"": ""AbFvOqntc-sFDlJ18K1Fi9xBOLWUltbPCLk0YlIc__l4mYc4TwbW6KNS3cQxZybCLHbx5sX2A-1U"", ""id"": 2139346, ""isDraft"": false, ""ratingText"": ""Delicious food, a bit on the pricy side for brunch. Especially if you want to add something on (eg. Mushrooms) becaus the added portion is quite small. But overall the food and coffee was good!"", ""ratingValue"": 4.0, ""replyByOpenAi"": true, ""reviewReply"": ""Hi Rakel!\n\nWe're thrilled you enjoyed the food and coffee at FACTORY GIRL, and we appreciate your honest feedback about the pricing and portion sizes for add-ons. We'll take your comments on board as we're always looking to improve our brunch experience while maintaining the quality you've come to expect from us in Amsterdam."", ""reviewReplyType"": ""dailyJobEmotionAI"", ""reviewerTitle"": ""rakel zetterlund"", ""url"": """", ""thirdPartyReviewSourcesId"": 69, ""locationId"": 93, ""processedByPastReplyJob"": false, ""replyFetchedByReviewAgent"": false, ""deleteReplyFailedByReviewAgent"": false, ""editReplyFailedByReviewAgent"": false, ""sentimentAnalysis"": ""Neutral"", ""satisfactoryLevel"": 70.0, ""reviewStatus"": NaN, ""reviewTags"": [], ""task_id"": NaN, ""location_id"": 93, ""location_enableReviewAgent"": true, ""task"": NaN, ""reviewStatus_deleteReplyFailed"": NaN, ""reviewStatus_editReplyFailed"": NaN, ""reviewStatus_requestStatus"": NaN, ""reviewStatus_saveReplyFailed"": NaN, ""reviewStatus_sessionError"": NaN}"
REV_2139347_G_AbFvOqlb,2139347,2025-03-16 00:27:11.929000+00:00,Mikala Narlock,5,,"Hello Mikala!

We're absolutely thrilled that you had a five-star experience at FACTORY GIRL in Amsterdam - your perfect rating means the world to us and motivates our team to keep delivering exceptional experiences. We hope to welcome you back soon for another amazing visit!",dailyJobEmotionAI,,0,93,AbFvOqlbLfuSNdBjlffFXgzvL3jfDr5Xi9ZH_Mez2_oK0l5FXCKKNwjRe-WbuENse206YBivYzKaeQ,69,,"{""date"": ""2025-03-16 00:27:11.929000+00:00"", ""google_review_id"": ""AbFvOqlbLfuSNdBjlffFXgzvL3jfDr5Xi9ZH_Mez2_oK0l5FXCKKNwjRe-WbuENse206YBivYzKaeQ"", ""id"": 2139347, ""isDraft"": false, ""ratingText"": """", ""ratingValue"": 5.0, ""replyByOpenAi"": true, ""reviewReply"": ""Hello Mikala!\n\nWe're absolutely thrilled that you had a five-star experience at FACTORY GIRL in Amsterdam - your perfect rating means the world to us and motivates our team to keep delivering exceptional experiences. We hope to welcome you back soon for another amazing visit!"", ""reviewReplyType"": ""dailyJobEmotionAI"", ""reviewerTitle"": ""Mikala Narlock"", ""url"": """", ""thirdPartyReviewSourcesId"": 69, ""locationId"": 93, ""processedByPastReplyJob"": false, ""replyFetchedByReviewAgent"": false, ""deleteReplyFailedByReviewAgent"": false, ""editReplyFailedByReviewAgent"": false, ""sentimentAnalysis"": null, ""satisfactoryLevel"": 0.0, ""reviewStatus"": NaN, ""reviewTags"": [], ""task_id"": NaN, ""location_id"": 93, ""location_enableReviewAgent"": true, ""task"": NaN, ""reviewStatus_deleteReplyFailed"": NaN, ""reviewStatus_editReplyFailed"": NaN, ""reviewStatus_requestStatus"": NaN, ""reviewStatus_saveReplyFailed"": NaN, ""reviewStatus_sessionError"": NaN}"